{
  "$id": "urn:citadelgrad:scott-cc:beads:safe-command-result:v1",
  "$schema": "https://json-schema.org/draft/2020-12/schema",
  "additionalProperties": false,
  "allOf": [
    {
      "if": {
        "properties": {
          "status": {
            "const": "REDACTION_FAILED"
          }
        }
      },
      "then": {
        "properties": {
          "stderr_bytes": {
            "type": "null"
          },
          "stderr_log": {
            "type": "null"
          },
          "stdout_bytes": {
            "type": "null"
          },
          "stdout_log": {
            "type": "null"
          }
        }
      }
    }
  ],
  "properties": {
    "argv_sha256": {
      "pattern": "^[0-9a-f]{64}$",
      "type": "string"
    },
    "error_code": {
      "anyOf": [
        {
          "maxLength": 4096,
          "minLength": 1,
          "pattern": "^[^\\x00]+$",
          "type": "string"
        },
        {
          "type": "null"
        }
      ]
    },
    "exit_code": {
      "anyOf": [
        {
          "type": "integer"
        },
        {
          "type": "null"
        }
      ]
    },
    "finished_at": {
      "pattern": "^[0-9]{4}-(?:0[1-9]|1[0-2])-(?:0[1-9]|[12][0-9]|3[01])T(?:[01][0-9]|2[0-3]):[0-5][0-9]:[0-5][0-9]\\.[0-9]{6}Z$",
      "type": "string"
    },
    "profile": {
      "enum": [
        "hermetic",
        "beads",
        "verification",
        "git_local",
        "dolt_local",
        "recovery_probe"
      ]
    },
    "redaction_count": {
      "maximum": 18446744073709551615,
      "minimum": 0,
      "type": "integer"
    },
    "schema_version": {
      "const": "beads.safe-command-result.v1"
    },
    "signal": {
      "anyOf": [
        {
          "type": "integer"
        },
        {
          "type": "null"
        }
      ]
    },
    "started_at": {
      "pattern": "^[0-9]{4}-(?:0[1-9]|1[0-2])-(?:0[1-9]|[12][0-9]|3[01])T(?:[01][0-9]|2[0-3]):[0-5][0-9]:[0-5][0-9]\\.[0-9]{6}Z$",
      "type": "string"
    },
    "status": {
      "enum": [
        "SUCCESS",
        "NONZERO_EXIT",
        "SPAWN_FAILED",
        "TIMED_OUT",
        "OUTPUT_LIMIT",
        "INVALID_ENCODING",
        "REDACTION_FAILED",
        "OUTPUT_POLICY_FAILED",
        "TERMINATION_UNKNOWN"
      ]
    },
    "stderr_bytes": {
      "anyOf": [
        {
          "maximum": 18446744073709551615,
          "minimum": 0,
          "type": "integer"
        },
        {
          "type": "null"
        }
      ]
    },
    "stderr_log": {
      "anyOf": [
        {
          "additionalProperties": false,
          "properties": {
            "path": {
              "maxLength": 4096,
              "minLength": 1,
              "pattern": "^/(?!/)(?!\\.{1,2}(?:/|$))(?!.*//)(?!.*(?:/)\\.{1,2}(?:/|$))[^\\x00]*$",
              "type": "string"
            },
            "sha256": {
              "pattern": "^[0-9a-f]{64}$",
              "type": "string"
            },
            "size_bytes": {
              "maximum": 18446744073709551615,
              "minimum": 0,
              "type": "integer"
            }
          },
          "required": [
            "path",
            "size_bytes",
            "sha256"
          ],
          "type": "object"
        },
        {
          "type": "null"
        }
      ]
    },
    "stdout_bytes": {
      "anyOf": [
        {
          "maximum": 18446744073709551615,
          "minimum": 0,
          "type": "integer"
        },
        {
          "type": "null"
        }
      ]
    },
    "stdout_log": {
      "anyOf": [
        {
          "additionalProperties": false,
          "properties": {
            "path": {
              "maxLength": 4096,
              "minLength": 1,
              "pattern": "^/(?!/)(?!\\.{1,2}(?:/|$))(?!.*//)(?!.*(?:/)\\.{1,2}(?:/|$))[^\\x00]*$",
              "type": "string"
            },
            "sha256": {
              "pattern": "^[0-9a-f]{64}$",
              "type": "string"
            },
            "size_bytes": {
              "maximum": 18446744073709551615,
              "minimum": 0,
              "type": "integer"
            }
          },
          "required": [
            "path",
            "size_bytes",
            "sha256"
          ],
          "type": "object"
        },
        {
          "type": "null"
        }
      ]
    }
  },
  "required": [
    "schema_version",
    "profile",
    "status",
    "exit_code",
    "signal",
    "redaction_count",
    "stdout_log",
    "stderr_log",
    "started_at",
    "finished_at",
    "error_code",
    "argv_sha256",
    "stdout_bytes",
    "stderr_bytes"
  ],
  "title": "safe-command-result v1",
  "type": "object"
}
